{
  "schema_version": "0.3-draft",
  "run_id": "run_018f6b2a-7c3a-7b10-8f3a-9c0b1d2e3f41",
  "session_id": "sess_018f6b2a-7c3a-7a1e-8f3a-9c0b1d2e3f40",
  "status": "Running",
  "terminal_reason": null,
  "last_sequence": 4,
  "input_ref": "input_001",
  "workspace_ref": "ws_readonly_01",
  "budget": {
    "max_model_calls": 8,
    "max_tool_calls": 24
  },
  "artifact_ids": ["artifact_018f6b2a-7c3a-7e40-8f3a-9c0b1d2e3f47"],
  "updated_at": "2026-10-21T01:22:03Z"
}
